{
  "schema": "fbsir.cognitive-source-ledger/v1",
  "catalogVersion": "26.7.20-cog.1",
  "sources": [
    {
      "sourceId": "src:internal-agent-contracts",
      "sourceType": "internal_curated",
      "title": "独董会九角色现有专业方法与边界",
      "publisherOrOwner": "FBSir",
      "locator": "../../../../agents/",
      "publishedAt": null,
      "retrievedAt": "2026-07-20",
      "effectiveFrom": "2026-07-20",
      "effectiveTo": null,
      "jurisdictions": ["*"],
      "authorityLevel": "internal_curated",
      "verificationStatus": "curated_summary",
      "contentSha256": null,
      "rightsBoundary": "internal_authorized_summary",
      "sensitivity": "internal",
      "reviewBy": "2027-07-20",
      "stalePolicy": "require_review",
      "summary": "仅提炼当前包内角色已声明的方法、证据纪律和人工关卡；不把角色设定写成现实履历或外部事实。"
    },
    {
      "sourceId": "src:internal-review-protocol",
      "sourceType": "internal_curated",
      "title": "独董会审议协议与运行宪章",
      "publisherOrOwner": "FBSir",
      "locator": "../../../../references/review-protocol.md",
      "publishedAt": null,
      "retrievedAt": "2026-07-20",
      "effectiveFrom": "2026-07-20",
      "effectiveTo": null,
      "jurisdictions": ["*"],
      "authorityLevel": "internal_curated",
      "verificationStatus": "curated_summary",
      "contentSha256": null,
      "rightsBoundary": "internal_authorized_summary",
      "sensitivity": "internal",
      "reviewBy": "2027-07-20",
      "stalePolicy": "require_review",
      "summary": "用于起手卡、首轮隔离、有限质询、N/N 收齐和证据边界，不替代宿主回执。"
    },
    {
      "sourceId": "src:internal-document-delivery",
      "sourceType": "internal_curated",
      "title": "长文档与正式产物协议",
      "publisherOrOwner": "FBSir",
      "locator": "../document-delivery.md",
      "publishedAt": null,
      "retrievedAt": "2026-07-20",
      "effectiveFrom": "2026-07-20",
      "effectiveTo": null,
      "jurisdictions": ["*"],
      "authorityLevel": "internal_curated",
      "verificationStatus": "curated_summary",
      "contentSha256": null,
      "rightsBoundary": "internal_authorized_summary",
      "sensitivity": "internal",
      "reviewBy": "2027-07-20",
      "stalePolicy": "require_review",
      "summary": "用于来源、异议、文件哈希、渲染预览、发布授权和人工验收门。"
    },
    {
      "sourceId": "src:nasa-independent-review",
      "sourceType": "official_primary",
      "title": "NASA Program and Project Guidance Documents",
      "publisherOrOwner": "NASA",
      "locator": "https://www.nasa.gov/ocfo/ppc-corner/ppc-guidance-documents/",
      "publishedAt": "2024-09-24",
      "retrievedAt": "2026-07-20",
      "effectiveFrom": null,
      "effectiveTo": null,
      "jurisdictions": ["US"],
      "authorityLevel": "official_primary",
      "verificationStatus": "link_verified",
      "contentSha256": null,
      "rightsBoundary": "public_official_link_short_summary",
      "sensitivity": "public",
      "reviewBy": "2027-01-20",
      "stalePolicy": "require_review",
      "summary": "仅借鉴独立评审先定义范围、职责和成功准则的程序结构；不把航天项目治理直接外推为企业结论。"
    },
    {
      "sourceId": "src:w3c-prov-o",
      "sourceType": "standard",
      "title": "PROV-O: The PROV Ontology",
      "publisherOrOwner": "W3C",
      "locator": "https://www.w3.org/TR/prov-o/",
      "publishedAt": "2013-04-30",
      "retrievedAt": "2026-07-20",
      "effectiveFrom": null,
      "effectiveTo": null,
      "jurisdictions": ["*"],
      "authorityLevel": "standards_body",
      "verificationStatus": "link_verified",
      "contentSha256": null,
      "rightsBoundary": "public_official_link_short_summary",
      "sensitivity": "public",
      "reviewBy": "2027-07-20",
      "stalePolicy": "require_review",
      "summary": "仅吸收实体、活动、责任、生成、使用和失效等来源关系；本包不复制标准正文，也不要求 RDF 实现。"
    },
    {
      "sourceId": "src:nist-ai-rmf-genai",
      "sourceType": "official_primary",
      "title": "Artificial Intelligence Risk Management Framework: Generative Artificial Intelligence Profile",
      "publisherOrOwner": "NIST",
      "locator": "https://nvlpubs.nist.gov/nistpubs/ai/NIST.AI.600-1.pdf",
      "publishedAt": "2024-07-26",
      "retrievedAt": "2026-07-20",
      "effectiveFrom": null,
      "effectiveTo": null,
      "jurisdictions": ["US"],
      "authorityLevel": "official_primary",
      "verificationStatus": "link_verified",
      "contentSha256": null,
      "rightsBoundary": "public_official_link_short_summary",
      "sensitivity": "public",
      "reviewBy": "2027-01-20",
      "stalePolicy": "require_review",
      "summary": "仅用于风险识别、评测、人工控制、第三方依赖和事件处置的结构；属于自愿框架，不代表认证或具体法律合规。"
    }
  ],
  "evidenceBoundary": "curated_links_and_short_summaries_only_not_external_facts_or_runtime_proof"
}
